smartctl 7.4 2023-08-01 r5530 [x86_64-linux-6.7.2-arch1-1] (local build)
Copyright (C) 2002-23, Bruce Allen, Christian Franke, www.smartmontools.org

=== START OF INFORMATION SECTION ===
Model Number:                       APPLE SSD AP0128J
Serial Number:                      C088471001LHV52AJ
Firmware Version:                   16.14.01
PCI Vendor/Subsystem ID:            0x106b
IEEE OUI Identifier:                0x000502
Controller ID:                      0
NVMe Version:                       <1.2
Number of Namespaces:               2
Namespace 1 Size/Capacity:          121,332,826,112 [121 GB]
Namespace 1 Formatted LBA Size:     4096
Namespace 1 IEEE EUI-64:            f80300 8028020500
Local Time is:                      Thu Feb  1 19:23:27 2024 CST
Firmware Updates (0x02):            1 Slot
Optional Admin Commands (0x0004):   Frmw_DL
Optional NVM Commands (0x0004):     DS_Mngmt
Maximum Data Transfer Size:         256 Pages

Supported Power States
St Op     Max   Active     Idle   RL RT WL WT  Ent_Lat  Ex_Lat
 0 +     0.00W       -        -    0  0  0  0        0       0

Supported LBA Sizes (NSID 0x1)
Id Fmt  Data  Metadt  Rel_Perf
 0 +    4096       0         0

=== START OF SMART DATA SECTION ===
SMART overall-health self-assessment test result: PASSED

SMART/Health Information (NVMe Log 0x02)
Critical Warning:                   0x00
Temperature:                        33 Celsius
Available Spare:                    88%
Available Spare Threshold:          2%
Percentage Used:                    50%
Data Units Read:                    415,183,385 [212 TB]
Data Units Written:                 383,376,219 [196 TB]
Host Read Commands:                 2,977,218,032
Host Write Commands:                1,866,878,412
Controller Busy Time:               0
Power Cycles:                       9,804
Power On Hours:                     978
Unsafe Shutdowns:                   29
Media and Data Integrity Errors:    0
Error Information Log Entries:      0

Read 1 entries from Error Information Log failed: Invalid Log Page (0x109)

